{
  "name": "Service hours panel",
  "url": "https://getbootstrap.com/docs/4.0/components/card/",
  "type": "d08dfbab-4e5d-4ecb-a2b6-084102be3446",
  "heading": "Service hours",
  "library": "6f6650a5-ebff-4783-8508-f0285c0e98a6",
  "guid": "6b3e057c-1587-4969-b032-7631b21e0e0e",
  "contributor_email": "",
  "contributor_name": "JCB ai-doc contributors",
  "contributor_website": "https://github.com/joomengine/ai-doc",
  "contributor_company": "",
  "snippet": "<section class=\"card\" aria-labelledby=\"service-hours-title\">\n\t<div class=\"card-body\">\n\t\t<h2 class=\"card-title\" id=\"service-hours-title\">Service hours</h2>\n\t\t<p class=\"card-text\">Monday to Friday, 08:00–17:00.</p>\n\t</div>\n</section>\n",
  "usage": "Copy the source into a Site View or Custom Admin View HTML editor. Configure the consumer for Bootstrap v4 CSS; this noninteractive panel needs no JavaScript. Replace the text with translated application content and escape dynamic values in their output context. Use a unique heading id for each panel and update aria-labelledby to match. This fixture is original CC0 documentation material, not a published production identity.",
  "description": "A noninteractive information panel with a visible heading and an explicit accessible section label.",
  "@dependencies": [
    {
      "key": "guid",
      "value": "d08dfbab-4e5d-4ecb-a2b6-084102be3446",
      "entity": "snippet_type",
      "table": "#__componentbuilder_snippet_type",
      "direction": "out"
    },
    {
      "key": "guid",
      "value": "6f6650a5-ebff-4783-8508-f0285c0e98a6",
      "entity": "library",
      "table": "#__componentbuilder_library",
      "direction": "out"
    }
  ]
}
